<?xml version="1.0" encoding="UTF-8"?>
<model xmlns:xsi="http://www.w3.org/2001/XMLSchema-instance" xsi:noNamespaceSchemaLocation="XMLSchemaaqc53z.xsd">
	<Tulajdonosok>
	
		<Tulajdonos Tkod="1">
			<Nev>Nagy Béla</Nev>
			<Szulido>
				<Ev>1987</Ev>
				<Honap>03</Honap>
				<Nap>12</Nap>
			</Szulido>
		</Tulajdonos>
		
		<Tulajdonos Tkod="2">
			<Nev>Lőre István</Nev>
			<Szulido>
				<Ev>1967</Ev>
				<Honap>10</Honap>
				<Nap>25</Nap>
			</Szulido>
		</Tulajdonos>
		
		<Tulajdonos Tkod="3">
			<Nev>Kiss Imre</Nev>
			<Szulido>
				<Ev>1980</Ev>
				<Honap>08</Honap>
				<Nap>20</Nap>
			</Szulido>
		</Tulajdonos>
		
	</Tulajdonosok>
	
	<Pizzeriak>
		<Pizzeria Pikod="1">
			<Nev>Italian Stallion</Nev>
			<Telefonszam>012432123</Telefonszam>
			<Cim>
				<Irszam>1256</Irszam>
				<Varos>Budapest</Varos>
				<Utca>Ferencziek útja</Utca>
				<Hazszam>14</Hazszam>
			</Cim>
		</Pizzeria>
		
		<Pizzeria Pikod="2">
			<Nev>New York Style</Nev>
			<Telefonszam>05618478</Telefonszam>
			<Cim>
				<Irszam>3525</Irszam>
				<Varos>Miskolc</Varos>
				<Utca>Széchenyi István út</Utca>
				<Hazszam>26</Hazszam>
			</Cim>
		</Pizzeria>
		
		<Pizzeria Pikod="3">
			<Nev>Lábas</Nev>
			<Telefonszam>035637923</Telefonszam>
			<Cim>
				<Irszam>3540</Irszam>
				<Varos>Alsózsolca</Varos>
				<Utca>Fő út</Utca>
				<Hazszam>6</Hazszam>
			</Cim>
		</Pizzeria>
	</Pizzeriak>
	
	<Pizzak>
		<Pizza Pkod="1">
			<Nev>Margareta</Nev>
			<Ar>1200</Ar>
			<Feltet>Sajt</Feltet>
		</Pizza>
		
		<Pizza Pkod="2">
			<Nev>Sonkás</Nev>
			<Ar>1400</Ar>
			<Feltet>Sajt</Feltet>
			<Feltet>Sonka</Feltet>
		</Pizza>
		
		<Pizza Pkod="3">
			<Nev>Szalámis</Nev>
			<Ar>1400</Ar>
			<Feltet>Sajt</Feltet>
			<Feltet>Szalámi</Feltet>
		</Pizza>
		
		<Pizza Pkod="4">
			<Nev>Sonkás-Kukoricás</Nev>
			<Ar>1600</Ar>
			<Feltet>Sajt</Feltet>
			<Feltet>Sonka</Feltet>
			<Feltet>Kukorica</Feltet>
		</Pizza>
		
		<Pizza Pkod="5">
			<Nev>Lábas Speciál</Nev>
			<Ar>2100</Ar>
			<Feltet>Sajt</Feltet>
			<Feltet>BBQ szósz</Feltet>
			<Feltet>Pulled Pork</Feltet>
			<Feltet>Bacon</Feltet>
		</Pizza>
	</Pizzak>
	
	<Vevok>
		<Vevo Vkod="1">
			<Nev>Nagy Ferenc</Nev>
			<Telefonszam>77895412</Telefonszam>
			<Cim>
				<Irszam>3519</Irszam>
				<Varos>Miskolc</Varos>
				<Utca>Fenyő utca</Utca>
				<Hazszam>23</Hazszam>
			</Cim>
		</Vevo>
		
		<Vevo Vkod="2">
			<Nev>Novák Balázs</Nev>
			<Telefonszam>078954412</Telefonszam>
			<Cim>
				<Irszam>1149</Irszam>
				<Varos>Budapest</Varos>
				<Utca>Vezér utca</Utca>
				<Hazszam>149</Hazszam>
			</Cim>
		</Vevo>
		
		<Vevo Vkod="3">
			<Nev>Trab Antal</Nev>
			<Telefonszam>012258</Telefonszam>
			<Cim>
				<Irszam>3530</Irszam>
				<Varos>Miskolc</Varos>
				<Utca>Pattantyús utca</Utca>
				<Hazszam>14</Hazszam>
			</Cim>
		</Vevo>
	</Vevok>
	
	<Tulajdonos_Pizzeria_kapcsolok>
		<Tulajdonos_Pizzeria Tulajdonosref="1" Pizzeriaref="1"></Tulajdonos_Pizzeria>
		<Tulajdonos_Pizzeria Tulajdonosref="2" Pizzeriaref="2"></Tulajdonos_Pizzeria>
		<Tulajdonos_Pizzeria Tulajdonosref="2" Pizzeriaref="3"></Tulajdonos_Pizzeria>
	</Tulajdonos_Pizzeria_kapcsolok>
	
	<Pizzeria_Pizza_kapcsolok>
		<Pizzeria_Pizza Pizzeriaref="1" Pizzaref="1"></Pizzeria_Pizza>
		<Pizzeria_Pizza Pizzeriaref="1" Pizzaref="3"></Pizzeria_Pizza>
		<Pizzeria_Pizza Pizzeriaref="2" Pizzaref="2"></Pizzeria_Pizza>
		<Pizzeria_Pizza Pizzeriaref="2" Pizzaref="4"></Pizzeria_Pizza>
		<Pizzeria_Pizza Pizzeriaref="3" Pizzaref="5"></Pizzeria_Pizza>
	</Pizzeria_Pizza_kapcsolok>
	
	<Pizza_Vevo_kapcsolok>
		<Pizza_Vevo Vevoref="1" Pizzaref="2"></Pizza_Vevo>
		<Pizza_Vevo Vevoref="2" Pizzaref="4"></Pizza_Vevo>
		<Pizza_Vevo Vevoref="3" Pizzaref="5"></Pizza_Vevo>
	</Pizza_Vevo_kapcsolok>
	
	
</model>